"x4312362995","x731760753846452224",2016-05-15 08:18:53,"FieldsMathEd","Is it reasonable to measure a room in hundreds of thousands of square metres? Why not? @Mr_Cariati #EngageMath https://t.co/FKZiVTjBh2","Twitter Web Client",140,,,,FALSE,TRUE,0,1,,,"EngageMath",,,,,,,,,,,,,"x519071841 x1346836142","MatthewOldridge Mr_Cariati","en",,,,,,,,,,,,,,,,"x730802054931697665","Is it reasonable to measure a room in hundreds of thousands of square metres? Why not? @Mr_Cariati #EngageMath https://t.co/FKZiVTjBh2",2016-05-12 16:49:22,"Twitter for iPhone",0,1,"x519071841","MatthewOldridge","Matthew Oldridge",11779,10021,55231,"Mississauga, ON","""Just a man"". Father, husband, educator, thinker about things. Professionally: curious about the world. Not: too much of a joiner.",FALSE,,,,,,,"NA NA","NA NA","NA NA NA NA NA NA NA NA","https://twitter.com/FieldsMathEd/status/731760753846452224","FieldsMathEd","Toronto, Ontario","We are the mathematics education forum from the Fields Institute","https://t.co/mioNyevGx7",FALSE,945,614,20,737,810,2015-11-29 00:13:09,FALSE,"https://t.co/mioNyevGx7","http://www.fields.utoronto.ca/programs/mathed/forum/index.html",,"https://pbs.twimg.com/profile_banners/4312362995/1451856217","http://abs.twimg.com/images/themes/theme1/bg.png","http://pbs.twimg.com/profile_images/683760471065915392/mrUJXSlg_normal.jpg"
"x4312362995","x724630191700631555",2016-04-25 16:04:35,"FieldsMathEd","On the TEDx stage yesterday, the full video will be out in 10 days or so. Viva La Revolution!  https://t.co/SOsYyv62SO","Twitter for Android",132,,,,FALSE,TRUE,0,83,,,,,"twitter.com/Stanford/statu…","https://t.co/SOsYyv62SO","https://twitter.com/Stanford/status/724395824734556160",,,,,,,,,"x179334563","joboaler","en",,,,,,,,,,,,,,,,"x724581224493146113","On the TEDx stage yesterday, the full video will be out in 10 days or so. Viva La Revolution!  https://t.co/SOsYyv62SO",2016-04-25 12:50:00,"Twitter Web Client",117,83,"x179334563","joboaler","Jo Boaler",102185,1425,5566,"Stanford University","Stanford Professor,  British Maths Revolutionary, Author: Limitless Mind, Online course experimenter, co-founder: https://t.co/CBvMt7XWsM & avid Baggies Fan! #BLM",TRUE,,,,,,,"NA NA","NA NA","NA NA NA NA NA NA NA NA","https://twitter.com/FieldsMathEd/status/724630191700631555","FieldsMathEd","Toronto, Ontario","We are the mathematics education forum from the Fields Institute","https://t.co/mioNyevGx7",FALSE,945,614,20,737,810,2015-11-29 00:13:09,FALSE,"https://t.co/mioNyevGx7","http://www.fields.utoronto.ca/programs/mathed/forum/index.html",,"https://pbs.twimg.com/profile_banners/4312362995/1451856217","http://abs.twimg.com/images/themes/theme1/bg.png","http://pbs.twimg.com/profile_images/683760471065915392/mrUJXSlg_normal.jpg"
"x4312362995","x724024399700066304",2016-04-23 23:57:23,"FieldsMathEd","A test I guarantee no programmer will ""fail""

https://t.co/AFbmOc9SuM

(via @droqen)","Twitter Web Client",103,,,,FALSE,TRUE,0,11,,,,,"nytimes.com/interactive/20…","https://t.co/AFbmOc9SuM","http://www.nytimes.com/interactive/2015/07/03/upshot/a-quick-puzzle-to-test-your-problem-solving.html?_r=0",,,,,,,,,"x18600956 x64937130","ColinNorthway droqen","en",,,,,,,,,,,,,,,,"x724020665544667137","A test I guarantee no programmer will ""fail""

https://t.co/AFbmOc9SuM

(via @droqen)",2016-04-23 23:42:32,"Twitter Web Client",21,11,"x18600956","ColinNorthway","ColinNorthway",8523,204,24973,"Vanvouver B.C. Canada","Incredipede, Deep Under the Sky & Fantastic Contraption. Working on @MuseumOR. First person to tweet from VR. Husband of @Sarah_Northway",FALSE,,,,,,,"NA NA","NA NA","NA NA NA NA NA NA NA NA","https://twitter.com/FieldsMathEd/status/724024399700066304","FieldsMathEd","Toronto, Ontario","We are the mathematics education forum from the Fields Institute","https://t.co/mioNyevGx7",FALSE,945,614,20,737,810,2015-11-29 00:13:09,FALSE,"https://t.co/mioNyevGx7","http://www.fields.utoronto.ca/programs/mathed/forum/index.html",,"https://pbs.twimg.com/profile_banners/4312362995/1451856217","http://abs.twimg.com/images/themes/theme1/bg.png","http://pbs.twimg.com/profile_images/683760471065915392/mrUJXSlg_normal.jpg"
"x4312362995","x723929052734742528",2016-04-23 17:38:30,"FieldsMathEd","#FieldsApril Here are the modules and videos from Zohreh https://t.co/SzcE0bhLkU","Twitter Web Client",80,,,,FALSE,FALSE,0,0,,,"FieldsApril",,"utsc.utoronto.ca/mslc/calculus-…","https://t.co/SzcE0bhLkU","https://utsc.utoronto.ca/mslc/calculus-pre-calculus-modules",,,,,,,,,,,"en",,,,,,,,,,,,,,,,,,,,,,,,,,,,,,,,,,,,,"NA NA","NA NA","NA NA NA NA NA NA NA NA","https://twitter.com/FieldsMathEd/status/723929052734742528","FieldsMathEd","Toronto, Ontario","We are the mathematics education forum from the Fields Institute","https://t.co/mioNyevGx7",FALSE,945,614,20,737,810,2015-11-29 00:13:09,FALSE,"https://t.co/mioNyevGx7","http://www.fields.utoronto.ca/programs/mathed/forum/index.html",,"https://pbs.twimg.com/profile_banners/4312362995/1451856217","http://abs.twimg.com/images/themes/theme1/bg.png","http://pbs.twimg.com/profile_images/683760471065915392/mrUJXSlg_normal.jpg"
"x4312362995","x723923759116238848",2016-04-23 17:17:28,"FieldsMathEd","#FieldsApril https://t.co/clIUoWNdT0","Twitter Web Client",36,,,,TRUE,FALSE,0,1,,,"FieldsApril",,"twitter.com/MathManAnusic/…","https://t.co/clIUoWNdT0","https://twitter.com/MathManAnusic/status/723922657767464960",,,,,,,,,,,"und","x723922657767464960","Zohreh Shahbazi @UofT uses Learning Goals with Ss in Calc, uses asmnt to guide teaching/learning #assesspeel https://t.co/VO2LrBPzOq",2016-04-23 17:13:06,"Twitter Web Client",1,1,"x869081558","MathManAnusic","Ve Anusic",1193,948,2544,"PDSB","St Achievement Officer - Min of Ed. teacher, instructional coach, curricular head of math, UofT OISE AQ facilitator. Love travel, math, tech, football etc..",FALSE,,,,,,,,,,,,,,,,,,,,,,"NA NA","NA NA","NA NA NA NA NA NA NA NA","https://twitter.com/FieldsMathEd/status/723923759116238848","FieldsMathEd","Toronto, Ontario","We are the mathematics education forum from the Fields Institute","https://t.co/mioNyevGx7",FALSE,945,614,20,737,810,2015-11-29 00:13:09,FALSE,"https://t.co/mioNyevGx7","http://www.fields.utoronto.ca/programs/mathed/forum/index.html",,"https://pbs.twimg.com/profile_banners/4312362995/1451856217","http://abs.twimg.com/images/themes/theme1/bg.png","http://pbs.twimg.com/profile_images/683760471065915392/mrUJXSlg_normal.jpg"
"x4312362995","x723922829343903744",2016-04-23 17:13:47,"FieldsMathEd","#FieldsApril https://t.co/3S2cu5DOmF","Twitter Web Client",36,,,,TRUE,FALSE,1,1,,,"FieldsApril",,"twitter.com/MathiesUnite/s…","https://t.co/3S2cu5DOmF","https://twitter.com/MathiesUnite/status/723903556357623808",,,,,,,,,,,"und","x723903556357623808","Kids will engage in math that is meaningful and interesting.  @FieldsMathEd #engagemath",2016-04-23 15:57:11,"Twitter for iPhone",4,2,"x2577222692","MathiesUnite","Alyssa Carmichael",303,302,695,"Mississauga, ON","Mom, secondary teacher, math nerd. Mathematics Department Head in PDSB.",FALSE,,,,,,,,,,,,,,,,,,,,,,"NA NA","NA NA","NA NA NA NA NA NA NA NA","https://twitter.com/FieldsMathEd/status/723922829343903744","FieldsMathEd","Toronto, Ontario","We are the mathematics education forum from the Fields Institute","https://t.co/mioNyevGx7",FALSE,945,614,20,737,810,2015-11-29 00:13:09,FALSE,"https://t.co/mioNyevGx7","http://www.fields.utoronto.ca/programs/mathed/forum/index.html",,"https://pbs.twimg.com/profile_banners/4312362995/1451856217","http://abs.twimg.com/images/themes/theme1/bg.png","http://pbs.twimg.com/profile_images/683760471065915392/mrUJXSlg_normal.jpg"
"x4312362995","x723921354370633728",2016-04-23 17:07:55,"FieldsMathEd","Yay! Backwards design. Aligned to diagnostics. Integrated design. https://t.co/Dz8IPrDAp0","Twitter Web Client",65,,,,FALSE,FALSE,0,0,,,,,,,,"http://pbs.twimg.com/media/CgvioqlUkAUlG3e.jpg","https://t.co/Dz8IPrDAp0","https://twitter.com/FieldsMathEd/status/723921354370633728/photo/1","photo","http://pbs.twimg.com/media/CgvioqlUkAUlG3e.jpg","https://t.co/Dz8IPrDAp0","https://twitter.com/FieldsMathEd/status/723921354370633728/photo/1",,,,"en",,,,,,,,,,,,,,,,,,,,,,,,,,,,,,,,,,,,,"NA NA","NA NA","NA NA NA NA NA NA NA NA","https://twitter.com/FieldsMathEd/status/723921354370633728","FieldsMathEd","Toronto, Ontario","We are the mathematics education forum from the Fields Institute","https://t.co/mioNyevGx7",FALSE,945,614,20,737,810,2015-11-29 00:13:09,FALSE,"https://t.co/mioNyevGx7","http://www.fields.utoronto.ca/programs/mathed/forum/index.html",,"https://pbs.twimg.com/profile_banners/4312362995/1451856217","http://abs.twimg.com/images/themes/theme1/bg.png","http://pbs.twimg.com/profile_images/683760471065915392/mrUJXSlg_normal.jpg"
"x4312362995","x723920908944068608",2016-04-23 17:06:09,"FieldsMathEd","#FieldsApril We're back streaming Zohreh Shahbazi. You can also watch again or later at https://t.co/oH0hxjdfqQ.","Twitter Web Client",112,,,,FALSE,FALSE,0,0,,,"FieldsApril",,"fields.utoronto.ca/live","https://t.co/oH0hxjdfqQ","http://www.fields.utoronto.ca/live",,,,,,,,,,,"en",,,,,,,,,,,,,,,,,,,,,,,,,,,,,,,,,,,,,"NA NA","NA NA","NA NA NA NA NA NA NA NA","https://twitter.com/FieldsMathEd/status/723920908944068608","FieldsMathEd","Toronto, Ontario","We are the mathematics education forum from the Fields Institute","https://t.co/mioNyevGx7",FALSE,945,614,20,737,810,2015-11-29 00:13:09,FALSE,"https://t.co/mioNyevGx7","http://www.fields.utoronto.ca/programs/mathed/forum/index.html",,"https://pbs.twimg.com/profile_banners/4312362995/1451856217","http://abs.twimg.com/images/themes/theme1/bg.png","http://pbs.twimg.com/profile_images/683760471065915392/mrUJXSlg_normal.jpg"
"x4312362995","x723904057761521664",2016-04-23 15:59:11,"FieldsMathEd","#FieldsApril We're coming up on lunchtime. We'll be back at 1:00 eastern time with Zohreh Shahbazi.","Twitter Web Client",99,,,,FALSE,FALSE,0,0,,,"FieldsApril",,,,,,,,,,,,,,,"en",,,,,,,,,,,,,,,,,,,,,,,,,,,,,,,,,,,,,"NA NA","NA NA","NA NA NA NA NA NA NA NA","https://twitter.com/FieldsMathEd/status/723904057761521664","FieldsMathEd","Toronto, Ontario","We are the mathematics education forum from the Fields Institute","https://t.co/mioNyevGx7",FALSE,945,614,20,737,810,2015-11-29 00:13:09,FALSE,"https://t.co/mioNyevGx7","http://www.fields.utoronto.ca/programs/mathed/forum/index.html",,"https://pbs.twimg.com/profile_banners/4312362995/1451856217","http://abs.twimg.com/images/themes/theme1/bg.png","http://pbs.twimg.com/profile_images/683760471065915392/mrUJXSlg_normal.jpg"
"x4312362995","x723903190027100161",2016-04-23 15:55:44,"FieldsMathEd","@FieldsMathEd @MathiesUnite definitely depends on whether everything is taught prior, then it's just regurgitation","Twitter Web Client",133,,,,FALSE,TRUE,0,1,,,,,,,,,,,,,,,,"x869081558 x4312362995 x2577222692","MathManAnusic FieldsMathEd MathiesUnite","en",,,,,,,,,,,,,,,,"x723902230840152065","@FieldsMathEd @MathiesUnite definitely depends on whether everything is taught prior, then it's just regurgitation",2016-04-23 15:51:55,"Twitter for Android",0,1,"x869081558","MathManAnusic","Ve Anusic",1193,948,2544,"PDSB","St Achievement Officer - Min of Ed. teacher, instructional coach, curricular head of math, UofT OISE AQ facilitator. Love travel, math, tech, football etc..",FALSE,,,,,,,"NA NA","NA NA","NA NA NA NA NA NA NA NA","https://twitter.com/FieldsMathEd/status/723903190027100161","FieldsMathEd","Toronto, Ontario","We are the mathematics education forum from the Fields Institute","https://t.co/mioNyevGx7",FALSE,945,614,20,737,810,2015-11-29 00:13:09,FALSE,"https://t.co/mioNyevGx7","http://www.fields.utoronto.ca/programs/mathed/forum/index.html",,"https://pbs.twimg.com/profile_banners/4312362995/1451856217","http://abs.twimg.com/images/themes/theme1/bg.png","http://pbs.twimg.com/profile_images/683760471065915392/mrUJXSlg_normal.jpg"
"x4312362995","x723903138068090880",2016-04-23 15:55:32,"FieldsMathEd","@FieldsMathEd it's what a T does with the problem and with Ss that makes it inquiry","Twitter Web Client",101,,,,FALSE,TRUE,0,1,,,,,,,,,,,,,,,,"x2577222692 x4312362995","MathiesUnite FieldsMathEd","en",,,,,,,,,,,,,,,,"x723902086757384192","@FieldsMathEd it's what a T does with the problem and with Ss that makes it inquiry",2016-04-23 15:51:21,"Twitter for iPhone",0,1,"x2577222692","MathiesUnite","Alyssa Carmichael",303,302,695,"Mississauga, ON","Mom, secondary teacher, math nerd. Mathematics Department Head in PDSB.",FALSE,,,,,,,"NA NA","NA NA","NA NA NA NA NA NA NA NA","https://twitter.com/FieldsMathEd/status/723903138068090880","FieldsMathEd","Toronto, Ontario","We are the mathematics education forum from the Fields Institute","https://t.co/mioNyevGx7",FALSE,945,614,20,737,810,2015-11-29 00:13:09,FALSE,"https://t.co/mioNyevGx7","http://www.fields.utoronto.ca/programs/mathed/forum/index.html",,"https://pbs.twimg.com/profile_banners/4312362995/1451856217","http://abs.twimg.com/images/themes/theme1/bg.png","http://pbs.twimg.com/profile_images/683760471065915392/mrUJXSlg_normal.jpg"
"x4312362995","x723902298049654784",2016-04-23 15:52:11,"FieldsMathEd","#FieldsApril Exploring for what we ""must know forever"" in calculus. https://t.co/YOAOW79vRv","Twitter Web Client",67,,,,FALSE,FALSE,0,0,,,"FieldsApril",,,,,"http://pbs.twimg.com/media/CgvRTaZU8AA19ts.jpg","https://t.co/YOAOW79vRv","https://twitter.com/FieldsMathEd/status/723902298049654784/photo/1","photo","http://pbs.twimg.com/media/CgvRTaZU8AA19ts.jpg http://pbs.twimg.com/media/CgvRTdSUgAAcjuY.jpg","https://t.co/YOAOW79vRv https://t.co/YOAOW79vRv","https://twitter.com/FieldsMathEd/status/723902298049654784/photo/1 https://twitter.com/FieldsMathEd/status/723902298049654784/photo/1",,,,"en",,,,,,,,,,,,,,,,,,,,,,,,,,,,,,,,,,,,,"NA NA","NA NA","NA NA NA NA NA NA NA NA","https://twitter.com/FieldsMathEd/status/723902298049654784","FieldsMathEd","Toronto, Ontario","We are the mathematics education forum from the Fields Institute","https://t.co/mioNyevGx7",FALSE,945,614,20,737,810,2015-11-29 00:13:09,FALSE,"https://t.co/mioNyevGx7","http://www.fields.utoronto.ca/programs/mathed/forum/index.html",,"https://pbs.twimg.com/profile_banners/4312362995/1451856217","http://abs.twimg.com/images/themes/theme1/bg.png","http://pbs.twimg.com/profile_images/683760471065915392/mrUJXSlg_normal.jpg"
"x4312362995","x723901456009564160",2016-04-23 15:48:51,"FieldsMathEd","@MathiesUnite Is this problem solving or inquiry? Maybe both? Maybe it depends on the approach of the teacher. https://t.co/L3RgOnLgu3","Twitter Web Client",110,"x723897770176815104","x2577222692","MathiesUnite",FALSE,FALSE,2,0,,,,,,,,"http://pbs.twimg.com/media/CgvQicFUoAEVJTW.jpg","https://t.co/L3RgOnLgu3","https://twitter.com/FieldsMathEd/status/723901456009564160/photo/1","photo","http://pbs.twimg.com/media/CgvQicFUoAEVJTW.jpg","https://t.co/L3RgOnLgu3","https://twitter.com/FieldsMathEd/status/723901456009564160/photo/1",,"x2577222692","MathiesUnite","en",,,,,,,,,,,,,,,,,,,,,,,,,,,,,,,,,,,,,"NA NA","NA NA","NA NA NA NA NA NA NA NA","https://twitter.com/FieldsMathEd/status/723901456009564160","FieldsMathEd","Toronto, Ontario","We are the mathematics education forum from the Fields Institute","https://t.co/mioNyevGx7",FALSE,945,614,20,737,810,2015-11-29 00:13:09,FALSE,"https://t.co/mioNyevGx7","http://www.fields.utoronto.ca/programs/mathed/forum/index.html",,"https://pbs.twimg.com/profile_banners/4312362995/1451856217","http://abs.twimg.com/images/themes/theme1/bg.png","http://pbs.twimg.com/profile_images/683760471065915392/mrUJXSlg_normal.jpg"
"x4312362995","x723900429113929728",2016-04-23 15:44:46,"FieldsMathEd","#FieldsApril Hey, @MathManAnusic and @MathiesUnite, we have a hashtag for our meeting.","Twitter Web Client",86,,,,FALSE,FALSE,0,0,,,"FieldsApril",,,,,,,,,,,,,"x869081558 x2577222692","MathManAnusic MathiesUnite","en",,,,,,,,,,,,,,,,,,,,,,,,,,,,,,,,,,,,,"NA NA","NA NA","NA NA NA NA NA NA NA NA","https://twitter.com/FieldsMathEd/status/723900429113929728","FieldsMathEd","Toronto, Ontario","We are the mathematics education forum from the Fields Institute","https://t.co/mioNyevGx7",FALSE,945,614,20,737,810,2015-11-29 00:13:09,FALSE,"https://t.co/mioNyevGx7","http://www.fields.utoronto.ca/programs/mathed/forum/index.html",,"https://pbs.twimg.com/profile_banners/4312362995/1451856217","http://abs.twimg.com/images/themes/theme1/bg.png","http://pbs.twimg.com/profile_images/683760471065915392/mrUJXSlg_normal.jpg"
"x4312362995","x723899799314022400",2016-04-23 15:42:16,"FieldsMathEd","Profs @SFU give diagnostic asmnt in calc to determine extra help groups. Provide timely feedbback, and time for ss to improve @FieldsMathEd","Twitter for Android",140,,,,FALSE,TRUE,0,4,,,,,,,,,,,,,,,,"x869081558 x8071702","MathManAnusic SFU","en",,,,,,,,,,,,,,,,"x723899659010347011","Profs @SFU give diagnostic asmnt in calc to determine extra help groups. Provide timely feedbback, and time for ss to improve @FieldsMathEd",2016-04-23 15:41:42,"Twitter for Android",4,4,"x869081558","MathManAnusic","Ve Anusic",1193,948,2544,"PDSB","St Achievement Officer - Min of Ed. teacher, instructional coach, curricular head of math, UofT OISE AQ facilitator. Love travel, math, tech, football etc..",FALSE,,,,,,,"NA NA","NA NA","NA NA NA NA NA NA NA NA","https://twitter.com/FieldsMathEd/status/723899799314022400","FieldsMathEd","Toronto, Ontario","We are the mathematics education forum from the Fields Institute","https://t.co/mioNyevGx7",FALSE,945,614,20,737,810,2015-11-29 00:13:09,FALSE,"https://t.co/mioNyevGx7","http://www.fields.utoronto.ca/programs/mathed/forum/index.html",,"https://pbs.twimg.com/profile_banners/4312362995/1451856217","http://abs.twimg.com/images/themes/theme1/bg.png","http://pbs.twimg.com/profile_images/683760471065915392/mrUJXSlg_normal.jpg"
"x4312362995","x723899432245313536",2016-04-23 15:40:48,"FieldsMathEd","#FieldsApril Regular in-class quizzes were an excellent predictor of final grades. https://t.co/Kt6TW3YWEj","Twitter Web Client",82,,,,FALSE,FALSE,0,0,,,"FieldsApril",,,,,"http://pbs.twimg.com/media/CgvOspTVEAc3dKV.jpg","https://t.co/Kt6TW3YWEj","https://twitter.com/FieldsMathEd/status/723899432245313536/photo/1","photo","http://pbs.twimg.com/media/CgvOspTVEAc3dKV.jpg","https://t.co/Kt6TW3YWEj","https://twitter.com/FieldsMathEd/status/723899432245313536/photo/1",,,,"en",,,,,,,,,,,,,,,,,,,,,,,,,,,,,,,,,,,,,"NA NA","NA NA","NA NA NA NA NA NA NA NA","https://twitter.com/FieldsMathEd/status/723899432245313536","FieldsMathEd","Toronto, Ontario","We are the mathematics education forum from the Fields Institute","https://t.co/mioNyevGx7",FALSE,945,614,20,737,810,2015-11-29 00:13:09,FALSE,"https://t.co/mioNyevGx7","http://www.fields.utoronto.ca/programs/mathed/forum/index.html",,"https://pbs.twimg.com/profile_banners/4312362995/1451856217","http://abs.twimg.com/images/themes/theme1/bg.png","http://pbs.twimg.com/profile_images/683760471065915392/mrUJXSlg_normal.jpg"
"x4312362995","x723898026138435584",2016-04-23 15:35:13,"FieldsMathEd","#FieldsApril Comparing diagnostics of 1st year calculus students those with background and those without. https://t.co/0LbV7qk2BH","Twitter Web Client",105,,,,FALSE,FALSE,0,1,,,"FieldsApril",,,,,"http://pbs.twimg.com/media/CgvNayyUoAAd0dj.jpg","https://t.co/0LbV7qk2BH","https://twitter.com/FieldsMathEd/status/723898026138435584/photo/1","photo","http://pbs.twimg.com/media/CgvNayyUoAAd0dj.jpg","https://t.co/0LbV7qk2BH","https://twitter.com/FieldsMathEd/status/723898026138435584/photo/1",,,,"en",,,,,,,,,,,,,,,,,,,,,,,,,,,,,,,,,,,,,"NA NA","NA NA","NA NA NA NA NA NA NA NA","https://twitter.com/FieldsMathEd/status/723898026138435584","FieldsMathEd","Toronto, Ontario","We are the mathematics education forum from the Fields Institute","https://t.co/mioNyevGx7",FALSE,945,614,20,737,810,2015-11-29 00:13:09,FALSE,"https://t.co/mioNyevGx7","http://www.fields.utoronto.ca/programs/mathed/forum/index.html",,"https://pbs.twimg.com/profile_banners/4312362995/1451856217","http://abs.twimg.com/images/themes/theme1/bg.png","http://pbs.twimg.com/profile_images/683760471065915392/mrUJXSlg_normal.jpg"
"x4312362995","x723896400765923328",2016-04-23 15:28:45,"FieldsMathEd","#FieldsApril Veselin Jungic is up. All the way from Simon Fraser University. We love having guests from afar.","Twitter Web Client",109,,,,FALSE,FALSE,1,0,,,"FieldsApril",,,,,,,,,,,,,,,"en",,,,,,,,,,,,,,,,,,,,,,,,,,,,,,,,,,,,,"NA NA","NA NA","NA NA NA NA NA NA NA NA","https://twitter.com/FieldsMathEd/status/723896400765923328","FieldsMathEd","Toronto, Ontario","We are the mathematics education forum from the Fields Institute","https://t.co/mioNyevGx7",FALSE,945,614,20,737,810,2015-11-29 00:13:09,FALSE,"https://t.co/mioNyevGx7","http://www.fields.utoronto.ca/programs/mathed/forum/index.html",,"https://pbs.twimg.com/profile_banners/4312362995/1451856217","http://abs.twimg.com/images/themes/theme1/bg.png","http://pbs.twimg.com/profile_images/683760471065915392/mrUJXSlg_normal.jpg"
"x4312362995","x723896004072886273",2016-04-23 15:27:11,"FieldsMathEd","#FieldsApril There are no simple answers to complex problems.","Twitter Web Client",61,,,,FALSE,FALSE,0,0,,,"FieldsApril",,,,,,,,,,,,,,,"en",,,,,,,,,,,,,,,,,,,,,,,,,,,,,,,,,,,,,"NA NA","NA NA","NA NA NA NA NA NA NA NA","https://twitter.com/FieldsMathEd/status/723896004072886273","FieldsMathEd","Toronto, Ontario","We are the mathematics education forum from the Fields Institute","https://t.co/mioNyevGx7",FALSE,945,614,20,737,810,2015-11-29 00:13:09,FALSE,"https://t.co/mioNyevGx7","http://www.fields.utoronto.ca/programs/mathed/forum/index.html",,"https://pbs.twimg.com/profile_banners/4312362995/1451856217","http://abs.twimg.com/images/themes/theme1/bg.png","http://pbs.twimg.com/profile_images/683760471065915392/mrUJXSlg_normal.jpg"
"x4312362995","x723895638560219139",2016-04-23 15:25:44,"FieldsMathEd","#FieldsApril If we keep getting the same results year after year, perhaps it is time to change our approach?","Twitter Web Client",108,,,,FALSE,FALSE,0,0,,,"FieldsApril",,,,,,,,,,,,,,,"en",,,,,,,,,,,,,,,,,,,,,,,,,,,,,,,,,,,,,"NA NA","NA NA","NA NA NA NA NA NA NA NA","https://twitter.com/FieldsMathEd/status/723895638560219139","FieldsMathEd","Toronto, Ontario","We are the mathematics education forum from the Fields Institute","https://t.co/mioNyevGx7",FALSE,945,614,20,737,810,2015-11-29 00:13:09,FALSE,"https://t.co/mioNyevGx7","http://www.fields.utoronto.ca/programs/mathed/forum/index.html",,"https://pbs.twimg.com/profile_banners/4312362995/1451856217","http://abs.twimg.com/images/themes/theme1/bg.png","http://pbs.twimg.com/profile_images/683760471065915392/mrUJXSlg_normal.jpg"
"x4312362995","x723888370418651136",2016-04-23 14:56:51,"FieldsMathEd","#FieldsApril The elephants in the (Class)room https://t.co/RNAR1nwaws See #5.","Twitter Web Client",77,,,,FALSE,FALSE,0,0,,,"FieldsApril",,"willrichardson.com/9-elephants-cl…","https://t.co/RNAR1nwaws","http://willrichardson.com/9-elephants-classroom-unsettle-us/",,,,,,,,,,,"en",,,,,,,,,,,,,,,,,,,,,,,,,,,,,,,,,,,,,"NA NA","NA NA","NA NA NA NA NA NA NA NA","https://twitter.com/FieldsMathEd/status/723888370418651136","FieldsMathEd","Toronto, Ontario","We are the mathematics education forum from the Fields Institute","https://t.co/mioNyevGx7",FALSE,945,614,20,737,810,2015-11-29 00:13:09,FALSE,"https://t.co/mioNyevGx7","http://www.fields.utoronto.ca/programs/mathed/forum/index.html",,"https://pbs.twimg.com/profile_banners/4312362995/1451856217","http://abs.twimg.com/images/themes/theme1/bg.png","http://pbs.twimg.com/profile_images/683760471065915392/mrUJXSlg_normal.jpg"
"x4312362995","x723886334436368384",2016-04-23 14:48:45,"FieldsMathEd","#FieldsApril Chris Brady: Understanding is the beginning of learning, not the end.","Twitter Web Client",82,,,,FALSE,FALSE,0,0,,,"FieldsApril",,,,,,,,,,,,,,,"en",,,,,,,,,,,,,,,,,,,,,,,,,,,,,,,,,,,,,"NA NA","NA NA","NA NA NA NA NA NA NA NA","https://twitter.com/FieldsMathEd/status/723886334436368384","FieldsMathEd","Toronto, Ontario","We are the mathematics education forum from the Fields Institute","https://t.co/mioNyevGx7",FALSE,945,614,20,737,810,2015-11-29 00:13:09,FALSE,"https://t.co/mioNyevGx7","http://www.fields.utoronto.ca/programs/mathed/forum/index.html",,"https://pbs.twimg.com/profile_banners/4312362995/1451856217","http://abs.twimg.com/images/themes/theme1/bg.png","http://pbs.twimg.com/profile_images/683760471065915392/mrUJXSlg_normal.jpg"
"x4312362995","x723886096451538945",2016-04-23 14:47:49,"FieldsMathEd","#FieldsApril Kids who learn to deal with the wall do well. You can prepare for your eventual wall by learning how to learn.","Twitter Web Client",123,,,,FALSE,FALSE,0,0,,,"FieldsApril",,,,,,,,,,,,,,,"en",,,,,,,,,,,,,,,,,,,,,,,,,,,,,,,,,,,,,"NA NA","NA NA","NA NA NA NA NA NA NA NA","https://twitter.com/FieldsMathEd/status/723886096451538945","FieldsMathEd","Toronto, Ontario","We are the mathematics education forum from the Fields Institute","https://t.co/mioNyevGx7",FALSE,945,614,20,737,810,2015-11-29 00:13:09,FALSE,"https://t.co/mioNyevGx7","http://www.fields.utoronto.ca/programs/mathed/forum/index.html",,"https://pbs.twimg.com/profile_banners/4312362995/1451856217","http://abs.twimg.com/images/themes/theme1/bg.png","http://pbs.twimg.com/profile_images/683760471065915392/mrUJXSlg_normal.jpg"
