"x4312362995","x1099351735389351937",2019-02-23 16:54:13,"FieldsMathEd","A fantastic, genuine framing of how things really work in his own classroom. Technology embraced in very interesting ways.","Twitter for iPhone",122,"x1099347106274426880","x4312362995","FieldsMathEd",FALSE,FALSE,1,0,,,,,,,,,,,,,,,,,,"en",,,,,,,,,,,,,,,,,,,,,,,,,,,,,,,,,,,,,"NA NA","NA NA","NA NA NA NA NA NA NA NA","https://twitter.com/FieldsMathEd/status/1099351735389351937","FieldsMathEd","Toronto, Ontario","We are the mathematics education forum from the Fields Institute","https://t.co/mioNyevGx7",FALSE,945,614,20,737,810,2015-11-29 00:13:09,FALSE,"https://t.co/mioNyevGx7","http://www.fields.utoronto.ca/programs/mathed/forum/index.html",,"https://pbs.twimg.com/profile_banners/4312362995/1451856217","http://abs.twimg.com/images/themes/theme1/bg.png","http://pbs.twimg.com/profile_images/683760471065915392/mrUJXSlg_normal.jpg"
"x4312362995","x1099347106274426880",2019-02-23 16:35:49,"FieldsMathEd","@DaveLanovaz tells what happens when the class does a test as a group. #assessments #ThinkingClassroom","Twitter for iPhone",102,,"x122246374","DaveLanovaz",FALSE,FALSE,3,1,,,"assessments ThinkingClassroom",,,,,,,,,,,,,"x122246374","DaveLanovaz","en",,,,,,,,,,,,,,,,,,,,,,,,,,,,,,,,,,,,,"NA NA","NA NA","NA NA NA NA NA NA NA NA","https://twitter.com/FieldsMathEd/status/1099347106274426880","FieldsMathEd","Toronto, Ontario","We are the mathematics education forum from the Fields Institute","https://t.co/mioNyevGx7",FALSE,945,614,20,737,810,2015-11-29 00:13:09,FALSE,"https://t.co/mioNyevGx7","http://www.fields.utoronto.ca/programs/mathed/forum/index.html",,"https://pbs.twimg.com/profile_banners/4312362995/1451856217","http://abs.twimg.com/images/themes/theme1/bg.png","http://pbs.twimg.com/profile_images/683760471065915392/mrUJXSlg_normal.jpg"
"x4312362995","x1099340465445445671",2019-02-23 16:09:26,"FieldsMathEd","14 opportunities for thinking in a Thinking Classroom and the practices for thinking @pgliljedahl @FieldsMathEd https://t.co/UAeBSEc1Gx","Twitter for iPhone",140,,,,FALSE,TRUE,0,10,,,,,,,,,,,,,,,,"x1532417730 x751854649104224256 x4312362995","ElleGBrayic pgliljedahl FieldsMathEd","en",,,,,,,,,,,,,,,,"x1099333994498441222","14 opportunities for thinking in a Thinking Classroom and the practices for thinking @pgliljedahl @FieldsMathEd https://t.co/UAeBSEc1Gx",2019-02-23 15:43:43,"Twitter for iPhone",20,10,"x1532417730","ElleGBrayic","Jennifer Holm",174,91,507,"Waterloo, Ontario","Assistant professor in Faculty of Education at Wilfrid Laurier University. Teaches mathematics education courses.",FALSE,,,,,,,"NA NA","NA NA","NA NA NA NA NA NA NA NA","https://twitter.com/FieldsMathEd/status/1099340465445445671","FieldsMathEd","Toronto, Ontario","We are the mathematics education forum from the Fields Institute","https://t.co/mioNyevGx7",FALSE,945,614,20,737,810,2015-11-29 00:13:09,FALSE,"https://t.co/mioNyevGx7","http://www.fields.utoronto.ca/programs/mathed/forum/index.html",,"https://pbs.twimg.com/profile_banners/4312362995/1451856217","http://abs.twimg.com/images/themes/theme1/bg.png","http://pbs.twimg.com/profile_images/683760471065915392/mrUJXSlg_normal.jpg"
"x4312362995","x1099329126966665216",2019-02-23 15:24:23,"FieldsMathEd","@MatthewOldridge @pgliljedahl @FieldsInstitute For anyone who couldn’t make it downtown, catch the talk live online https://t.co/8N1lMGMqX1 #FieldsLive","Twitter for iPhone",104,"x1099328670475345927","x519071841","MatthewOldridge",FALSE,FALSE,5,8,,,"FieldsLive",,"fields.utoronto.ca/live","https://t.co/8N1lMGMqX1","https://www.fields.utoronto.ca/live",,,,,,,,,"x519071841 x751854649104224256 x84873162","MatthewOldridge pgliljedahl FieldsInstitute","en",,,,,,,,,,,,,,,,,,,,,,,,,,,,,,,,,,,,,"NA NA","NA NA","NA NA NA NA NA NA NA NA","https://twitter.com/FieldsMathEd/status/1099329126966665216","FieldsMathEd","Toronto, Ontario","We are the mathematics education forum from the Fields Institute","https://t.co/mioNyevGx7",FALSE,945,614,20,737,810,2015-11-29 00:13:09,FALSE,"https://t.co/mioNyevGx7","http://www.fields.utoronto.ca/programs/mathed/forum/index.html",,"https://pbs.twimg.com/profile_banners/4312362995/1451856217","http://abs.twimg.com/images/themes/theme1/bg.png","http://pbs.twimg.com/profile_images/683760471065915392/mrUJXSlg_normal.jpg"
"x4312362995","x1099328887278981124",2019-02-23 15:23:25,"FieldsMathEd",".@pgliljedahl has received the Margaret Sinclair Memorial Award from @FieldsMathEd @FieldsInstitute. His lecture, “Building Thinking Classrooms” is next.","Twitter for iPhone",140,,,,FALSE,TRUE,0,5,,,,,,,,,,,,,,,,"x519071841 x751854649104224256 x4312362995 x84873162","MatthewOldridge pgliljedahl FieldsMathEd FieldsInstitute","en",,,,,,,,,,,,,,,,"x1099328670475345927",".@pgliljedahl has received the Margaret Sinclair Memorial Award from @FieldsMathEd @FieldsInstitute. His lecture, “Building Thinking Classrooms” is next.",2019-02-23 15:22:34,"Twitter for iPhone",20,5,"x519071841","MatthewOldridge","Matthew Oldridge",11779,10021,55231,"Mississauga, ON","""Just a man"". Father, husband, educator, thinker about things. Professionally: curious about the world. Not: too much of a joiner.",FALSE,,,,,,,"NA NA","NA NA","NA NA NA NA NA NA NA NA","https://twitter.com/FieldsMathEd/status/1099328887278981124","FieldsMathEd","Toronto, Ontario","We are the mathematics education forum from the Fields Institute","https://t.co/mioNyevGx7",FALSE,945,614,20,737,810,2015-11-29 00:13:09,FALSE,"https://t.co/mioNyevGx7","http://www.fields.utoronto.ca/programs/mathed/forum/index.html",,"https://pbs.twimg.com/profile_banners/4312362995/1451856217","http://abs.twimg.com/images/themes/theme1/bg.png","http://pbs.twimg.com/profile_images/683760471065915392/mrUJXSlg_normal.jpg"
"x4312362995","x1099328840764141569",2019-02-23 15:23:14,"FieldsMathEd","Congrats @pgliljedahl on receiving the Margaret Sinclair Award for Innovation and Excellence in Mathematics Education @FieldsMathEd https://t.co/9SrTxsz16F","Twitter for iPhone",140,,,,FALSE,TRUE,0,4,,,,,,,,,,,,,,,,"x751854649104224256","pgliljedahl","en",,,,,,,,,,,,,,,,"x1099328275443343361","Congrats @pgliljedahl on receiving the Margaret Sinclair Award for Innovation and Excellence in Mathematics Education @FieldsMathEd https://t.co/9SrTxsz16F",2019-02-23 15:21:00,"Twitter for Android",28,4,"x1154176322","MsBriggsMath","Ms. Briggs",572,661,4090,"Halton","Teacher, lifelong learner, OISE MEd candidate, OSSTF D20 Teachers VP",FALSE,,,,,,,"NA NA","NA NA","NA NA NA NA NA NA NA NA","https://twitter.com/FieldsMathEd/status/1099328840764141569","FieldsMathEd","Toronto, Ontario","We are the mathematics education forum from the Fields Institute","https://t.co/mioNyevGx7",FALSE,945,614,20,737,810,2015-11-29 00:13:09,FALSE,"https://t.co/mioNyevGx7","http://www.fields.utoronto.ca/programs/mathed/forum/index.html",,"https://pbs.twimg.com/profile_banners/4312362995/1451856217","http://abs.twimg.com/images/themes/theme1/bg.png","http://pbs.twimg.com/profile_images/683760471065915392/mrUJXSlg_normal.jpg"
"x4312362995","x1099328820572811265",2019-02-23 15:23:10,"FieldsMathEd","Awesome to be at @FieldsMathEd to see @pgliljedahl receive the Margaret Sinclair Award for Innovation and Excellence in Mathematics Education. 
Selection committee was a visibly random group working vertically on a NPS. #ThinkingClassroom https://t.co/RaM0zenILl","Twitter for iPhone",140,,,,FALSE,TRUE,0,7,,,,,,,,,,,,,,,,"x68957605 x4312362995 x751854649104224256","realJ_Mitchell FieldsMathEd pgliljedahl","en",,,,,,,,,,,,,,,,"x1099328586719346688","Awesome to be at @FieldsMathEd to see @pgliljedahl receive the Margaret Sinclair Award for Innovation and Excellence in Mathematics Education. 
Selection committee was a visibly random group working vertically on a NPS. #ThinkingClassroom https://t.co/RaM0zenILl",2019-02-23 15:22:14,"Twitter for iPhone",22,7,"x68957605","realJ_Mitchell","Jamie Mitchell",3471,375,24061,"Burlington, Ontario","#OntEd Teacher - Innovation Advocate - Zombie Hunter - Prime Ministers Award for Teaching Excellence: Certificate of Achievement Recipient - He/Him",FALSE,,,,,,,"NA NA","NA NA","NA NA NA NA NA NA NA NA","https://twitter.com/FieldsMathEd/status/1099328820572811265","FieldsMathEd","Toronto, Ontario","We are the mathematics education forum from the Fields Institute","https://t.co/mioNyevGx7",FALSE,945,614,20,737,810,2015-11-29 00:13:09,FALSE,"https://t.co/mioNyevGx7","http://www.fields.utoronto.ca/programs/mathed/forum/index.html",,"https://pbs.twimg.com/profile_banners/4312362995/1451856217","http://abs.twimg.com/images/themes/theme1/bg.png","http://pbs.twimg.com/profile_images/683760471065915392/mrUJXSlg_normal.jpg"
"x4312362995","x1099325366441861121",2019-02-23 15:09:26,"FieldsMathEd","Stewart Craven, long time member of the Fields MathEd Forum community kicks off the session with memories of Margaret Sinclair. https://t.co/c9ht180hhn","Twitter for iPhone",127,,,,FALSE,FALSE,9,1,,,,,,,,"http://pbs.twimg.com/media/D0GWltUXQAYqkWc.jpg","https://t.co/c9ht180hhn","https://twitter.com/FieldsMathEd/status/1099325366441861121/photo/1","photo","http://pbs.twimg.com/media/D0GWltUXQAYqkWc.jpg","https://t.co/c9ht180hhn","https://twitter.com/FieldsMathEd/status/1099325366441861121/photo/1",,,,"en",,,,,,,,,,,,,,,,,,,,,,,,,,,,,,,,,,,,,"NA NA","NA NA","NA NA NA NA NA NA NA NA","https://twitter.com/FieldsMathEd/status/1099325366441861121","FieldsMathEd","Toronto, Ontario","We are the mathematics education forum from the Fields Institute","https://t.co/mioNyevGx7",FALSE,945,614,20,737,810,2015-11-29 00:13:09,FALSE,"https://t.co/mioNyevGx7","http://www.fields.utoronto.ca/programs/mathed/forum/index.html",,"https://pbs.twimg.com/profile_banners/4312362995/1451856217","http://abs.twimg.com/images/themes/theme1/bg.png","http://pbs.twimg.com/profile_images/683760471065915392/mrUJXSlg_normal.jpg"
"x4312362995","x1098379981007347712",2019-02-21 00:32:49,"FieldsMathEd","Thinking about and Enacting Thinking Classrooms -- The Margaret Sinclair Memorial Award Lecture: Peter Liljedahl, Saturday Feb 23 @FieldsMathEd . Register at https://t.co/APJgulonVt https://t.co/2QKL2qvKII","Twitter Web Client",181,,,,FALSE,FALSE,22,13,,,,,"eventbrite.ca/e/margaret-sin…","https://t.co/APJgulonVt","https://www.eventbrite.ca/e/margaret-sinclair-memorial-award-lecture-peter-liljedahl-tickets-56575971253","http://pbs.twimg.com/media/Dz46To-XcAAuIXq.jpg","https://t.co/2QKL2qvKII","https://twitter.com/FieldsMathEd/status/1098379981007347712/photo/1","photo","http://pbs.twimg.com/media/Dz46To-XcAAuIXq.jpg","https://t.co/2QKL2qvKII","https://twitter.com/FieldsMathEd/status/1098379981007347712/photo/1",,"x4312362995","FieldsMathEd","en",,,,,,,,,,,,,,,,,,,,,,,,,,,,,,,,,,,,,"NA NA","NA NA","NA NA NA NA NA NA NA NA","https://twitter.com/FieldsMathEd/status/1098379981007347712","FieldsMathEd","Toronto, Ontario","We are the mathematics education forum from the Fields Institute","https://t.co/mioNyevGx7",FALSE,945,614,20,737,810,2015-11-29 00:13:09,FALSE,"https://t.co/mioNyevGx7","http://www.fields.utoronto.ca/programs/mathed/forum/index.html",,"https://pbs.twimg.com/profile_banners/4312362995/1451856217","http://abs.twimg.com/images/themes/theme1/bg.png","http://pbs.twimg.com/profile_images/683760471065915392/mrUJXSlg_normal.jpg"
"x4312362995","x1093185185317863425",2019-02-06 16:30:33,"FieldsMathEd","There is still time to submit a nomination for this year's Margaret Sinclair Award for Innovation and Excellence in Mathematics Education . Nominations close on Feb 28. Go to https://t.co/yoMe0ulRCb","Twitter Web Client",198,,,,FALSE,FALSE,11,7,,,,,"fields.utoronto.ca/honours-and-fe…","https://t.co/yoMe0ulRCb","http://www.fields.utoronto.ca/honours-and-fellowships/margaret-sinclair-memorial-award",,,,,,,,,,,"en",,,,,,,,,,,,,,,,,,,,,,,,,,,,,,,,,,,,,"NA NA","NA NA","NA NA NA NA NA NA NA NA","https://twitter.com/FieldsMathEd/status/1093185185317863425","FieldsMathEd","Toronto, Ontario","We are the mathematics education forum from the Fields Institute","https://t.co/mioNyevGx7",FALSE,945,614,20,737,810,2015-11-29 00:13:09,FALSE,"https://t.co/mioNyevGx7","http://www.fields.utoronto.ca/programs/mathed/forum/index.html",,"https://pbs.twimg.com/profile_banners/4312362995/1451856217","http://abs.twimg.com/images/themes/theme1/bg.png","http://pbs.twimg.com/profile_images/683760471065915392/mrUJXSlg_normal.jpg"
"x4312362995","x1089600919401054208",2019-01-27 19:07:57,"FieldsMathEd","Using network theory to analyze mathematical discussions by students... with Dr Jerome Proulx! Cool way to explore modeling what goes on in a math classroom. @FieldsMathEd Research Day. #mathematics #research #education","Twitter for iPhone",140,,,,FALSE,TRUE,0,3,,,,,,,,,,,,,,,,"x1460704644","314_per","en",,,,,,,,,,,,,,,,"x1089203630954156032","Using network theory to analyze mathematical discussions by students... with Dr Jerome Proulx! Cool way to explore modeling what goes on in a math classroom. @FieldsMathEd Research Day. #mathematics #research #education",2019-01-26 16:49:16,"Twitter for iPhone",9,3,"x1460704644","314_per","Dr Jamie Pyper",309,805,889,"Ontario, Canada","Queen's U. | math educator & researcher | math teacher (OCT) | and craft beer enthusiast! | he/him | #MSTE Coordinator, #PBLmathEd #CMESG #GCEDM #NCTM",FALSE,,,,,,,"NA NA","NA NA","NA NA NA NA NA NA NA NA","https://twitter.com/FieldsMathEd/status/1089600919401054208","FieldsMathEd","Toronto, Ontario","We are the mathematics education forum from the Fields Institute","https://t.co/mioNyevGx7",FALSE,945,614,20,737,810,2015-11-29 00:13:09,FALSE,"https://t.co/mioNyevGx7","http://www.fields.utoronto.ca/programs/mathed/forum/index.html",,"https://pbs.twimg.com/profile_banners/4312362995/1451856217","http://abs.twimg.com/images/themes/theme1/bg.png","http://pbs.twimg.com/profile_images/683760471065915392/mrUJXSlg_normal.jpg"
"x4312362995","x1089194928171819008",2019-01-26 16:14:41,"FieldsMathEd","Professor Nicol encourages preservice teachers to come up with #math questions related to global issues such as food waste and water usage #SDG @FieldsMathEd #researchday https://t.co/dt5JRirwdw","Twitter for iPhone",140,,,,FALSE,TRUE,0,2,,,"math",,,,,,,,,,,,,"x2859786382","lisaannefloyd","en",,,,,,,,,,,,,,,,"x1089187973395038208","Professor Nicol encourages preservice teachers to come up with #math questions related to global issues such as food waste and water usage #SDG @FieldsMathEd #researchday https://t.co/dt5JRirwdw",2019-01-26 15:47:03,"Twitter for iPhone",11,2,"x2859786382","lisaannefloyd","Lisa Anne Floyd",8844,7781,15931,"London, Ontario","PhD Student~Researcher: K-12 Teacher Education, Computational Thinking, Coding~Lifelong Learner/Teacher~Western U Instructor~Speaker~BSc BEd MPEd-Math",FALSE,,,,,,,"NA NA","NA NA","NA NA NA NA NA NA NA NA","https://twitter.com/FieldsMathEd/status/1089194928171819008","FieldsMathEd","Toronto, Ontario","We are the mathematics education forum from the Fields Institute","https://t.co/mioNyevGx7",FALSE,945,614,20,737,810,2015-11-29 00:13:09,FALSE,"https://t.co/mioNyevGx7","http://www.fields.utoronto.ca/programs/mathed/forum/index.html",,"https://pbs.twimg.com/profile_banners/4312362995/1451856217","http://abs.twimg.com/images/themes/theme1/bg.png","http://pbs.twimg.com/profile_images/683760471065915392/mrUJXSlg_normal.jpg"
"x4312362995","x1089194911096864768",2019-01-26 16:14:37,"FieldsMathEd","Resources to check out related to Decolonizing Mathematics Teaching: Approaches to Teaching Mathematics from Prof Nicol @FieldsMathEd https://t.co/FRHvrQeHsT","Twitter for iPhone",139,,,,FALSE,TRUE,0,1,,,,,,,,,,,,,,,,"x2859786382","lisaannefloyd","en",,,,,,,,,,,,,,,,"x1089190352286818306","Resources to check out related to Decolonizing Mathematics Teaching: Approaches to Teaching Mathematics from Prof Nicol @FieldsMathEd https://t.co/FRHvrQeHsT",2019-01-26 15:56:30,"Twitter for iPhone",4,1,"x2859786382","lisaannefloyd","Lisa Anne Floyd",8844,7781,15931,"London, Ontario","PhD Student~Researcher: K-12 Teacher Education, Computational Thinking, Coding~Lifelong Learner/Teacher~Western U Instructor~Speaker~BSc BEd MPEd-Math",FALSE,,,,,,,"NA NA","NA NA","NA NA NA NA NA NA NA NA","https://twitter.com/FieldsMathEd/status/1089194911096864768","FieldsMathEd","Toronto, Ontario","We are the mathematics education forum from the Fields Institute","https://t.co/mioNyevGx7",FALSE,945,614,20,737,810,2015-11-29 00:13:09,FALSE,"https://t.co/mioNyevGx7","http://www.fields.utoronto.ca/programs/mathed/forum/index.html",,"https://pbs.twimg.com/profile_banners/4312362995/1451856217","http://abs.twimg.com/images/themes/theme1/bg.png","http://pbs.twimg.com/profile_images/683760471065915392/mrUJXSlg_normal.jpg"
"x4312362995","x1089194835502948352",2019-01-26 16:14:19,"FieldsMathEd","@GoslinK123 echoes of our conversations are being spoken @FieldsMathEd https://t.co/cOoxswhfZb","Twitter for iPhone",108,,,,FALSE,TRUE,0,2,,,,,,,,"http://pbs.twimg.com/media/Dx2VKbNUcAEjRt_.jpg","https://t.co/cOoxswhfZb","https://twitter.com/Roosloan/status/1089190697893281792/photo/1","photo","http://pbs.twimg.com/media/Dx2VKbNUcAEjRt_.jpg","https://t.co/cOoxswhfZb","https://twitter.com/Roosloan/status/1089190697893281792/photo/1",,"x366312352 x254676866 x4312362995","Roosloan GoslinK123 FieldsMathEd","en",,,,,,,,,,,,,,,,"x1089190697893281792","@GoslinK123 echoes of our conversations are being spoken @FieldsMathEd https://t.co/cOoxswhfZb",2019-01-26 15:57:53,"Twitter for iPhone",3,2,"x366312352","Roosloan","Ruthie",1827,2853,8944,"","",FALSE,,,,,,,"NA NA","NA NA","NA NA NA NA NA NA NA NA","https://twitter.com/FieldsMathEd/status/1089194835502948352","FieldsMathEd","Toronto, Ontario","We are the mathematics education forum from the Fields Institute","https://t.co/mioNyevGx7",FALSE,945,614,20,737,810,2015-11-29 00:13:09,FALSE,"https://t.co/mioNyevGx7","http://www.fields.utoronto.ca/programs/mathed/forum/index.html",,"https://pbs.twimg.com/profile_banners/4312362995/1451856217","http://abs.twimg.com/images/themes/theme1/bg.png","http://pbs.twimg.com/profile_images/683760471065915392/mrUJXSlg_normal.jpg"
"x4312362995","x1089194777021693954",2019-01-26 16:14:05,"FieldsMathEd","Engaging our students in action and making a difference using mathematics @FieldsMathEd https://t.co/cNII4tgJjg","Twitter for iPhone",129,,,,FALSE,TRUE,0,5,,,,,,,,"http://pbs.twimg.com/media/Dx2VErMU8AAk_9T.jpg","https://t.co/cNII4tgJjg","https://twitter.com/judy11235813/status/1089190603571777537/photo/1","photo","http://pbs.twimg.com/media/Dx2VErMU8AAk_9T.jpg","https://t.co/cNII4tgJjg","https://twitter.com/judy11235813/status/1089190603571777537/photo/1",,"x1142609880 x4312362995","judy11235813 FieldsMathEd","en",,,,,,,,,,,,,,,,"x1089190603571777537","Engaging our students in action and making a difference using mathematics @FieldsMathEd https://t.co/cNII4tgJjg",2019-01-26 15:57:30,"Twitter for Android",8,5,"x1142609880","judy11235813","Judy",114,40,889,"","",FALSE,,,,,,,"NA NA","NA NA","NA NA NA NA NA NA NA NA","https://twitter.com/FieldsMathEd/status/1089194777021693954","FieldsMathEd","Toronto, Ontario","We are the mathematics education forum from the Fields Institute","https://t.co/mioNyevGx7",FALSE,945,614,20,737,810,2015-11-29 00:13:09,FALSE,"https://t.co/mioNyevGx7","http://www.fields.utoronto.ca/programs/mathed/forum/index.html",,"https://pbs.twimg.com/profile_banners/4312362995/1451856217","http://abs.twimg.com/images/themes/theme1/bg.png","http://pbs.twimg.com/profile_images/683760471065915392/mrUJXSlg_normal.jpg"
"x4312362995","x1089194715130548224",2019-01-26 16:13:51,"FieldsMathEd","Listening to Cynthia Nicol talk about moving beyond relevancy pedagogy to responsiveness to Ss lived truths- climate and environment. @FieldsMathEd https://t.co/eXkXZdus46","Twitter for iPhone",140,,,,FALSE,TRUE,0,2,,,,,,,,,,,,,,,,"x366312352","Roosloan","en",,,,,,,,,,,,,,,,"x1089192019652694024","Listening to Cynthia Nicol talk about moving beyond relevancy pedagogy to responsiveness to Ss lived truths- climate and environment. @FieldsMathEd https://t.co/eXkXZdus46",2019-01-26 16:03:08,"Twitter for iPhone",1,2,"x366312352","Roosloan","Ruthie",1827,2853,8944,"","",FALSE,,,,,,,"NA NA","NA NA","NA NA NA NA NA NA NA NA","https://twitter.com/FieldsMathEd/status/1089194715130548224","FieldsMathEd","Toronto, Ontario","We are the mathematics education forum from the Fields Institute","https://t.co/mioNyevGx7",FALSE,945,614,20,737,810,2015-11-29 00:13:09,FALSE,"https://t.co/mioNyevGx7","http://www.fields.utoronto.ca/programs/mathed/forum/index.html",,"https://pbs.twimg.com/profile_banners/4312362995/1451856217","http://abs.twimg.com/images/themes/theme1/bg.png","http://pbs.twimg.com/profile_images/683760471065915392/mrUJXSlg_normal.jpg"
"x4312362995","x1089194674349359106",2019-01-26 16:13:41,"FieldsMathEd","Grateful to have the opportunity to share - Teacher Candidates' Key Understandings about Computational Thinking in Mathematics and Science Education this Saturday at @FieldsMathEd https://t.co/encyoyBehg  #math #science #coding #computationalthinking https://t.co/1Udn9BECmd","Twitter for iPhone",140,,,,FALSE,TRUE,0,6,,,,,,,,,,,,,,,,"x2859786382","lisaannefloyd","en",,,,,,,,,,,,,,,,"x1088858981525729280","Grateful to have the opportunity to share - Teacher Candidates' Key Understandings about Computational Thinking in Mathematics and Science Education this Saturday at @FieldsMathEd https://t.co/encyoyBehg  #math #science #coding #computationalthinking https://t.co/1Udn9BECmd",2019-01-25 17:59:45,"Twitter Web Client",14,6,"x2859786382","lisaannefloyd","Lisa Anne Floyd",8844,7781,15931,"London, Ontario","PhD Student~Researcher: K-12 Teacher Education, Computational Thinking, Coding~Lifelong Learner/Teacher~Western U Instructor~Speaker~BSc BEd MPEd-Math",FALSE,,,,,,,"NA NA","NA NA","NA NA NA NA NA NA NA NA","https://twitter.com/FieldsMathEd/status/1089194674349359106","FieldsMathEd","Toronto, Ontario","We are the mathematics education forum from the Fields Institute","https://t.co/mioNyevGx7",FALSE,945,614,20,737,810,2015-11-29 00:13:09,FALSE,"https://t.co/mioNyevGx7","http://www.fields.utoronto.ca/programs/mathed/forum/index.html",,"https://pbs.twimg.com/profile_banners/4312362995/1451856217","http://abs.twimg.com/images/themes/theme1/bg.png","http://pbs.twimg.com/profile_images/683760471065915392/mrUJXSlg_normal.jpg"
"x4312362995","x1089194609912279040",2019-01-26 16:13:25,"FieldsMathEd","Haida Gwaii students teaching about how mathematics can bring us together @FieldsMathEd","Twitter for iPhone",105,,,,FALSE,TRUE,0,2,,,,,,,,,,,,,,,,"x1142609880 x4312362995","judy11235813 FieldsMathEd","en",,,,,,,,,,,,,,,,"x1089180066712555522","Haida Gwaii students teaching about how mathematics can bring us together @FieldsMathEd",2019-01-26 15:15:38,"Twitter for Android",4,2,"x1142609880","judy11235813","Judy",114,40,889,"","",FALSE,,,,,,,"NA NA","NA NA","NA NA NA NA NA NA NA NA","https://twitter.com/FieldsMathEd/status/1089194609912279040","FieldsMathEd","Toronto, Ontario","We are the mathematics education forum from the Fields Institute","https://t.co/mioNyevGx7",FALSE,945,614,20,737,810,2015-11-29 00:13:09,FALSE,"https://t.co/mioNyevGx7","http://www.fields.utoronto.ca/programs/mathed/forum/index.html",,"https://pbs.twimg.com/profile_banners/4312362995/1451856217","http://abs.twimg.com/images/themes/theme1/bg.png","http://pbs.twimg.com/profile_images/683760471065915392/mrUJXSlg_normal.jpg"
"x4312362995","x1086661881568337926",2019-01-19 16:29:16,"FieldsMathEd","Never too young to start learning calculus… https://t.co/FoCYaY28ju","Twitter for iPhone",87,,,,FALSE,TRUE,0,154,,,,,,,,"http://pbs.twimg.com/media/DxPXIrJW0AEjVNC.jpg","https://t.co/FoCYaY28ju","https://twitter.com/stevenstrogatz/status/1086448481739460608/photo/1","photo","http://pbs.twimg.com/media/DxPXIrJW0AEjVNC.jpg","https://t.co/FoCYaY28ju","https://twitter.com/stevenstrogatz/status/1086448481739460608/photo/1",,"x579299426","stevenstrogatz","en",,,,,,,,,,,,,,,,"x1086448481739460608","Never too young to start learning calculus… https://t.co/FoCYaY28ju",2019-01-19 02:21:17,"Twitter for iPhone",828,154,"x579299426","stevenstrogatz","Steven Strogatz",87618,1922,26982,"Ithaca, NY","Mathematician, writer, Cornell professor. All cards on the table, face up, all the time.",TRUE,,,,,,,"NA NA","NA NA","NA NA NA NA NA NA NA NA","https://twitter.com/FieldsMathEd/status/1086661881568337926","FieldsMathEd","Toronto, Ontario","We are the mathematics education forum from the Fields Institute","https://t.co/mioNyevGx7",FALSE,945,614,20,737,810,2015-11-29 00:13:09,FALSE,"https://t.co/mioNyevGx7","http://www.fields.utoronto.ca/programs/mathed/forum/index.html",,"https://pbs.twimg.com/profile_banners/4312362995/1451856217","http://abs.twimg.com/images/themes/theme1/bg.png","http://pbs.twimg.com/profile_images/683760471065915392/mrUJXSlg_normal.jpg"
"x4312362995","x1085677841050673152",2019-01-16 23:19:02,"FieldsMathEd","January 26 is @FieldsMathEd Research Day.! Everyone is welcome! Please register at https://t.co/CjO6SGW940","Twitter Web Client",106,,,,FALSE,FALSE,3,1,,,,,"fields.utoronto.ca/activities/18-…","https://t.co/CjO6SGW940","http://www.fields.utoronto.ca/activities/18-19/MEForum-Jan",,,,,,,,,"x4312362995","FieldsMathEd","en",,,,,,,,,,,,,,,,,,,,,,,,,,,,,,,,,,,,,"NA NA","NA NA","NA NA NA NA NA NA NA NA","https://twitter.com/FieldsMathEd/status/1085677841050673152","FieldsMathEd","Toronto, Ontario","We are the mathematics education forum from the Fields Institute","https://t.co/mioNyevGx7",FALSE,945,614,20,737,810,2015-11-29 00:13:09,FALSE,"https://t.co/mioNyevGx7","http://www.fields.utoronto.ca/programs/mathed/forum/index.html",,"https://pbs.twimg.com/profile_banners/4312362995/1451856217","http://abs.twimg.com/images/themes/theme1/bg.png","http://pbs.twimg.com/profile_images/683760471065915392/mrUJXSlg_normal.jpg"
