"x4312362995","x1145449306020884480",2019-06-30 21:49:30,"FieldsMathEd","Escher and Coxeter - A Mathematical Conversation - a lovely companion piece to King of Infinite Space #MathEdBookClub @FieldsMathEd https://t.co/lOGQJ05qbt via @Brewminate","Twitter for iPhone",140,,,,FALSE,TRUE,0,2,,,"MathEdBookClub",,,,,,,,,,,,,"x1142609880","judy11235813","en",,,,,,,,,,,,,,,,"x1145401156270743552","Escher and Coxeter - A Mathematical Conversation - a lovely companion piece to King of Infinite Space #MathEdBookClub @FieldsMathEd https://t.co/lOGQJ05qbt via @Brewminate",2019-06-30 18:38:10,"Twitter for Android",2,2,"x1142609880","judy11235813","Judy",114,40,889,"","",FALSE,,,,,,,"NA NA","NA NA","NA NA NA NA NA NA NA NA","https://twitter.com/FieldsMathEd/status/1145449306020884480","FieldsMathEd","Toronto, Ontario","We are the mathematics education forum from the Fields Institute","https://t.co/mioNyevGx7",FALSE,945,614,20,737,810,2015-11-29 00:13:09,FALSE,"https://t.co/mioNyevGx7","http://www.fields.utoronto.ca/programs/mathed/forum/index.html",,"https://pbs.twimg.com/profile_banners/4312362995/1451856217","http://abs.twimg.com/images/themes/theme1/bg.png","http://pbs.twimg.com/profile_images/683760471065915392/mrUJXSlg_normal.jpg"
"x4312362995","x1145315780499824641",2019-06-30 12:58:55,"FieldsMathEd","So excited about this #NOMAmath book club! I'm grateful to @Stephen_Hurley for helping us figure out how to host a podcast on @voicEdcanada for this. Starts July 16. You don't have to live in Northern Ontario to join in! #iteachmath #cyberPD #NearNorthUnited @fryed @RamonaMeharg https://t.co/WcYaaZlSnZ","Twitter for iPhone",140,,,,FALSE,TRUE,0,8,,,"NOMAmath",,,,,,,,,,,,,"x2437709061 x23057694","LisaCorbett0261 Stephen_Hurley","en",,,,,,,,,,,,,,,,"x1144954675852140545","So excited about this #NOMAmath book club! I'm grateful to @Stephen_Hurley for helping us figure out how to host a podcast on @voicEdcanada for this. Starts July 16. You don't have to live in Northern Ontario to join in! #iteachmath #cyberPD #NearNorthUnited @fryed @RamonaMeharg https://t.co/WcYaaZlSnZ",2019-06-29 13:04:01,"Twitter Web Client",21,8,"x2437709061","LisaCorbett0261","Lisa",954,634,13671,"Ontario, Canada","Elementary school teacher. Reader. Writer. Self-reg champion! Jersey Girl. MEd student at @NipissingU",FALSE,,,,,,,"NA NA","NA NA","NA NA NA NA NA NA NA NA","https://twitter.com/FieldsMathEd/status/1145315780499824641","FieldsMathEd","Toronto, Ontario","We are the mathematics education forum from the Fields Institute","https://t.co/mioNyevGx7",FALSE,945,614,20,737,810,2015-11-29 00:13:09,FALSE,"https://t.co/mioNyevGx7","http://www.fields.utoronto.ca/programs/mathed/forum/index.html",,"https://pbs.twimg.com/profile_banners/4312362995/1451856217","http://abs.twimg.com/images/themes/theme1/bg.png","http://pbs.twimg.com/profile_images/683760471065915392/mrUJXSlg_normal.jpg"
"x4312362995","x1144554666786795520",2019-06-28 10:34:32,"FieldsMathEd","Minister Duncan is at @fieldsinstitute to announce a new collaboration with @NRC_CNRC. Tune in to this @facebook page at 11:00 a.m. (ET) to watch it live:
https://t.co/62fF7KBxMa","Twitter for iPhone",139,,,,FALSE,TRUE,0,1,,,,,,,,,,,,,,,,"x84873162 x84873162 x365581151 x2425151","FieldsInstitute FieldsInstitute NRC_CNRC Facebook","en",,,,,,,,,,,,,,,,"x1144244187551981570","Minister Duncan is at @fieldsinstitute to announce a new collaboration with @NRC_CNRC. Tune in to this @facebook page at 11:00 a.m. (ET) to watch it live:
https://t.co/62fF7KBxMa",2019-06-27 14:00:47,"Sprout Social",4,1,"x84873162","FieldsInstitute","The Fields Institute",9302,788,4111,"Toronto, Canada","The Fields Institute is a centre for mathematical research. Our mission is to provide a supportive and stimulating environment for mathematics innovation.",TRUE,,,,,,,"NA NA","NA NA","NA NA NA NA NA NA NA NA","https://twitter.com/FieldsMathEd/status/1144554666786795520","FieldsMathEd","Toronto, Ontario","We are the mathematics education forum from the Fields Institute","https://t.co/mioNyevGx7",FALSE,945,614,20,737,810,2015-11-29 00:13:09,FALSE,"https://t.co/mioNyevGx7","http://www.fields.utoronto.ca/programs/mathed/forum/index.html",,"https://pbs.twimg.com/profile_banners/4312362995/1451856217","http://abs.twimg.com/images/themes/theme1/bg.png","http://pbs.twimg.com/profile_images/683760471065915392/mrUJXSlg_normal.jpg"
"x4312362995","x1144322101354082304",2019-06-27 19:10:24,"FieldsMathEd","@ONeducation @Sflecce Ontario’s Ministry of Education plays a massive role in shaping the circumstances in which our children develop into intellectually capable citizens. Join us in conversation at the Fields Institute from September to April as we confront the latest issues touching MathEd!","Twitter for iPhone",271,"x1143218297820913664","x179555829","ONeducation",FALSE,FALSE,1,0,,,,,,,,,,,,,,,,"x179555829 x1276123381","ONeducation Sflecce","en",,,,,,,,,,,,,,,,,,,,,,,,,,,,,,,,,,,,,"NA NA","NA NA","NA NA NA NA NA NA NA NA","https://twitter.com/FieldsMathEd/status/1144322101354082304","FieldsMathEd","Toronto, Ontario","We are the mathematics education forum from the Fields Institute","https://t.co/mioNyevGx7",FALSE,945,614,20,737,810,2015-11-29 00:13:09,FALSE,"https://t.co/mioNyevGx7","http://www.fields.utoronto.ca/programs/mathed/forum/index.html",,"https://pbs.twimg.com/profile_banners/4312362995/1451856217","http://abs.twimg.com/images/themes/theme1/bg.png","http://pbs.twimg.com/profile_images/683760471065915392/mrUJXSlg_normal.jpg"
"x4312362995","x1144321341237211142",2019-06-27 19:07:22,"FieldsMathEd","@OAMEcounts @OAMElearns @FieldsMathEd @mknrcm ! Join @CHAMPOAME this summer and read ""Multiplication is for White People"": Raising Expectations for Other People's Children https://t.co/Oj103EhJQ3 https://t.co/KmfiGTAZeG","Twitter for iPhone",140,,,,FALSE,TRUE,0,2,,,,,,,,,,,,,,,,"x1142609880 x878134022 x987334537238667264 x4312362995 x798710386518360068 x1375809140","judy11235813 OAMEcounts OAMElearns FieldsMathEd mknrcm CHAMPOAME","en",,,,,,,,,,,,,,,,"x1143696900018835457","@OAMEcounts @OAMElearns @FieldsMathEd @mknrcm ! Join @CHAMPOAME this summer and read ""Multiplication is for White People"": Raising Expectations for Other People's Children https://t.co/Oj103EhJQ3 https://t.co/KmfiGTAZeG",2019-06-26 01:46:04,"Twitter Web App",2,2,"x1142609880","judy11235813","Judy",114,40,889,"","",FALSE,,,,,,,"NA NA","NA NA","NA NA NA NA NA NA NA NA","https://twitter.com/FieldsMathEd/status/1144321341237211142","FieldsMathEd","Toronto, Ontario","We are the mathematics education forum from the Fields Institute","https://t.co/mioNyevGx7",FALSE,945,614,20,737,810,2015-11-29 00:13:09,FALSE,"https://t.co/mioNyevGx7","http://www.fields.utoronto.ca/programs/mathed/forum/index.html",,"https://pbs.twimg.com/profile_banners/4312362995/1451856217","http://abs.twimg.com/images/themes/theme1/bg.png","http://pbs.twimg.com/profile_images/683760471065915392/mrUJXSlg_normal.jpg"
"x4312362995","x1143201894552281089",2019-06-24 16:59:05,"FieldsMathEd","@FieldsMathEd #MathEdBookClub discussion: ""The visual is central to all levels of mathematics. It changes the questions you ask, it changes the methods you use, it changes the answers, and it changes the way mathematicians communicate and think."" (Whiteley) Thoughts? https://t.co/mCtBetNBl6","Twitter for iPhone",140,,,,FALSE,TRUE,0,2,,,"MathEdBookClub",,,,,,,,,,,,,"x1142609880 x4312362995","judy11235813 FieldsMathEd","en",,,,,,,,,,,,,,,,"x1143200930130726912","@FieldsMathEd #MathEdBookClub discussion: ""The visual is central to all levels of mathematics. It changes the questions you ask, it changes the methods you use, it changes the answers, and it changes the way mathematicians communicate and think."" (Whiteley) Thoughts? https://t.co/mCtBetNBl6",2019-06-24 16:55:16,"Twitter Web App",3,2,"x1142609880","judy11235813","Judy",114,40,889,"","",FALSE,,,,,,,"NA NA","NA NA","NA NA NA NA NA NA NA NA","https://twitter.com/FieldsMathEd/status/1143201894552281089","FieldsMathEd","Toronto, Ontario","We are the mathematics education forum from the Fields Institute","https://t.co/mioNyevGx7",FALSE,945,614,20,737,810,2015-11-29 00:13:09,FALSE,"https://t.co/mioNyevGx7","http://www.fields.utoronto.ca/programs/mathed/forum/index.html",,"https://pbs.twimg.com/profile_banners/4312362995/1451856217","http://abs.twimg.com/images/themes/theme1/bg.png","http://pbs.twimg.com/profile_images/683760471065915392/mrUJXSlg_normal.jpg"
"x4312362995","x1141804610228764688",2019-06-20 20:26:47,"FieldsMathEd","Check out our new fractions pathways website: https://t.co/NyNYyXi09A Here's the multiplication and division component of the pathway. All those cells are HOTLINKS to tasks and other resources. @ShelleyYearley @taracflynn Shout out to @uptergroveGreg for his technical magic! https://t.co/El9RGuiF0W","Twitter for iPhone",140,,,,FALSE,TRUE,0,94,,,,,"fractionslearningpathways.ca","https://t.co/NyNYyXi09A","http://www.fractionslearningpathways.ca",,,,,,,,,"x1264968134","drcathybruce","en",,,,,,,,,,,,,,,,"x1141439742195785728","Check out our new fractions pathways website: https://t.co/NyNYyXi09A Here's the multiplication and division component of the pathway. All those cells are HOTLINKS to tasks and other resources. @ShelleyYearley @taracflynn Shout out to @uptergroveGreg for his technical magic! https://t.co/El9RGuiF0W",2019-06-19 20:16:56,"Twitter Web Client",152,94,"x1264968134","drcathybruce","Cathy Bruce",6791,3009,4765,"Trent University","Cathy Bruce, (A)VP Research & Innovation @trentuniversity Research on teaching #math #m4yc, on traditional territory of the Anishinaabe Mississauga",FALSE,,,,,,,"NA NA","NA NA","NA NA NA NA NA NA NA NA","https://twitter.com/FieldsMathEd/status/1141804610228764688","FieldsMathEd","Toronto, Ontario","We are the mathematics education forum from the Fields Institute","https://t.co/mioNyevGx7",FALSE,945,614,20,737,810,2015-11-29 00:13:09,FALSE,"https://t.co/mioNyevGx7","http://www.fields.utoronto.ca/programs/mathed/forum/index.html",,"https://pbs.twimg.com/profile_banners/4312362995/1451856217","http://abs.twimg.com/images/themes/theme1/bg.png","http://pbs.twimg.com/profile_images/683760471065915392/mrUJXSlg_normal.jpg"
"x4312362995","x1141804483225239559",2019-06-20 20:26:17,"FieldsMathEd","New relationships are being revealed! Mathematicians look for patterns and arrive at structures rather than starting with them. @FieldsMathEd @FieldsInstitute https://t.co/wrNFHhRSI0","Twitter for iPhone",140,,,,FALSE,TRUE,0,1,,,,,,,,,,,,,,,,"x1142609880","judy11235813","en",,,,,,,,,,,,,,,,"x1141784909415092224","New relationships are being revealed! Mathematicians look for patterns and arrive at structures rather than starting with them. @FieldsMathEd @FieldsInstitute https://t.co/wrNFHhRSI0",2019-06-20 19:08:30,"Twitter Web App",1,1,"x1142609880","judy11235813","Judy",114,40,889,"","",FALSE,,,,,,,"NA NA","NA NA","NA NA NA NA NA NA NA NA","https://twitter.com/FieldsMathEd/status/1141804483225239559","FieldsMathEd","Toronto, Ontario","We are the mathematics education forum from the Fields Institute","https://t.co/mioNyevGx7",FALSE,945,614,20,737,810,2015-11-29 00:13:09,FALSE,"https://t.co/mioNyevGx7","http://www.fields.utoronto.ca/programs/mathed/forum/index.html",,"https://pbs.twimg.com/profile_banners/4312362995/1451856217","http://abs.twimg.com/images/themes/theme1/bg.png","http://pbs.twimg.com/profile_images/683760471065915392/mrUJXSlg_normal.jpg"
"x4312362995","x1138040130411925505",2019-06-10 11:08:05,"FieldsMathEd","MathEd REWIND: ""Taking the Leap: Creating a Markless Classroom"" by Erin Marsella (@math_mom13 ) of York Region District School Board. 
 
Lecture Video: https://t.co/sGgpUju9Dm (Feb 23, 2019)
@GlobeAndMail Article: https://t.co/ArrDg1BoOD  (March 19, 2019) https://t.co/1IRAkkrKPy","Sendible",255,,,,FALSE,FALSE,2,0,,,,,"bit.ly/2UGkePK tgam.ca/2vqhQCp","https://t.co/sGgpUju9Dm https://t.co/ArrDg1BoOD","http://bit.ly/2UGkePK https://tgam.ca/2vqhQCp","http://pbs.twimg.com/media/D8shd1yWwAAq8zW.jpg","https://t.co/1IRAkkrKPy","https://twitter.com/FieldsMathEd/status/1138040130411925505/photo/1","photo","http://pbs.twimg.com/media/D8shd1yWwAAq8zW.jpg","https://t.co/1IRAkkrKPy","https://twitter.com/FieldsMathEd/status/1138040130411925505/photo/1",,"x3680803757 x8736882","math_mom13 globeandmail","en",,,,,,,,,,,,,,,,,,,,,,,,,,,,,,,,,,,,,"NA NA","NA NA","NA NA NA NA NA NA NA NA","https://twitter.com/FieldsMathEd/status/1138040130411925505","FieldsMathEd","Toronto, Ontario","We are the mathematics education forum from the Fields Institute","https://t.co/mioNyevGx7",FALSE,945,614,20,737,810,2015-11-29 00:13:09,FALSE,"https://t.co/mioNyevGx7","http://www.fields.utoronto.ca/programs/mathed/forum/index.html",,"https://pbs.twimg.com/profile_banners/4312362995/1451856217","http://abs.twimg.com/images/themes/theme1/bg.png","http://pbs.twimg.com/profile_images/683760471065915392/mrUJXSlg_normal.jpg"
"x4312362995","x1137839830325518336",2019-06-09 21:52:10,"FieldsMathEd","For @FieldsMathEd #MathEdBookClub readers of Coxeter - Einstein: ""I attach special importance to the view of geometry which I have just set forth, because without it I should have been unable to formulate the theory of relativity."" https://t.co/ZbECakjjGi https://t.co/kjcLrozRnd","Twitter for iPhone",140,,,,FALSE,TRUE,0,3,,,"MathEdBookClub",,,,,,,,,,,,,"x1142609880 x4312362995","judy11235813 FieldsMathEd","en",,,,,,,,,,,,,,,,"x1137818741453053952","For @FieldsMathEd #MathEdBookClub readers of Coxeter - Einstein: ""I attach special importance to the view of geometry which I have just set forth, because without it I should have been unable to formulate the theory of relativity."" https://t.co/ZbECakjjGi https://t.co/kjcLrozRnd",2019-06-09 20:28:22,"Twitter Web App",4,3,"x1142609880","judy11235813","Judy",114,40,889,"","",FALSE,,,,,,,"NA NA","NA NA","NA NA NA NA NA NA NA NA","https://twitter.com/FieldsMathEd/status/1137839830325518336","FieldsMathEd","Toronto, Ontario","We are the mathematics education forum from the Fields Institute","https://t.co/mioNyevGx7",FALSE,945,614,20,737,810,2015-11-29 00:13:09,FALSE,"https://t.co/mioNyevGx7","http://www.fields.utoronto.ca/programs/mathed/forum/index.html",,"https://pbs.twimg.com/profile_banners/4312362995/1451856217","http://abs.twimg.com/images/themes/theme1/bg.png","http://pbs.twimg.com/profile_images/683760471065915392/mrUJXSlg_normal.jpg"
"x4312362995","x1137795268290797569",2019-06-09 18:55:05,"FieldsMathEd","HRH Coxeter's story.
If you have not seen 'the man who saved geometry' here is a link to it. Worth an hour, if you have seen it and it is more than three years, watch it again. ;-) https://t.co/I1mG5Sdb8p","Twitter for iPhone",140,,,,FALSE,TRUE,0,3,,,,,,,,,,,,,,,,"x284238539","PaulsPrattle","en",,,,,,,,,,,,,,,,"x1137789590465581057","HRH Coxeter's story.
If you have not seen 'the man who saved geometry' here is a link to it. Worth an hour, if you have seen it and it is more than three years, watch it again. ;-) https://t.co/I1mG5Sdb8p",2019-06-09 18:32:32,"TweetDeck",5,3,"x284238539","PaulsPrattle","Paul O'Malley",176,382,7405,"Dublin City, Ireland","Life long learner. I still know nothing. Being wrong is a chance to learn. Correct me when I'm wrong.",FALSE,,,,,,,"NA NA","NA NA","NA NA NA NA NA NA NA NA","https://twitter.com/FieldsMathEd/status/1137795268290797569","FieldsMathEd","Toronto, Ontario","We are the mathematics education forum from the Fields Institute","https://t.co/mioNyevGx7",FALSE,945,614,20,737,810,2015-11-29 00:13:09,FALSE,"https://t.co/mioNyevGx7","http://www.fields.utoronto.ca/programs/mathed/forum/index.html",,"https://pbs.twimg.com/profile_banners/4312362995/1451856217","http://abs.twimg.com/images/themes/theme1/bg.png","http://pbs.twimg.com/profile_images/683760471065915392/mrUJXSlg_normal.jpg"
"x4312362995","x1137785481230528515",2019-06-09 18:16:12,"FieldsMathEd","Hey @OAMEcounts @mknrcm @youcubed @maanow @canmathsociety @sioroberts! Join us @FieldsMathEd this summer as we explore Geometry through Coxeter bio. Use #MathEdBookClub to join our discussions. https://t.co/IeWS8ohmCe","Twitter for iPhone",140,,,,FALSE,TRUE,0,1,,,,,,,,,,,,,,,,"x1142609880 x878134022 x798710386518360068 x2212920252 x49666871 x278688410 x469277383 x4312362995","judy11235813 OAMEcounts mknrcm youcubed maanow canmathsociety sioroberts FieldsMathEd","en",,,,,,,,,,,,,,,,"x1137769628476805120","Hey @OAMEcounts @mknrcm @youcubed @maanow @canmathsociety @sioroberts! Join us @FieldsMathEd this summer as we explore Geometry through Coxeter bio. Use #MathEdBookClub to join our discussions. https://t.co/IeWS8ohmCe",2019-06-09 17:13:12,"Twitter Web App",3,1,"x1142609880","judy11235813","Judy",114,40,889,"","",FALSE,,,,,,,"NA NA","NA NA","NA NA NA NA NA NA NA NA","https://twitter.com/FieldsMathEd/status/1137785481230528515","FieldsMathEd","Toronto, Ontario","We are the mathematics education forum from the Fields Institute","https://t.co/mioNyevGx7",FALSE,945,614,20,737,810,2015-11-29 00:13:09,FALSE,"https://t.co/mioNyevGx7","http://www.fields.utoronto.ca/programs/mathed/forum/index.html",,"https://pbs.twimg.com/profile_banners/4312362995/1451856217","http://abs.twimg.com/images/themes/theme1/bg.png","http://pbs.twimg.com/profile_images/683760471065915392/mrUJXSlg_normal.jpg"
"x4312362995","x1137769788569214978",2019-06-09 17:13:50,"FieldsMathEd","Hey @OAMEcounts @mknrcm @youcubed @maanow @canmathsociety @sioroberts! Join us @FieldsMathEd this summer as we explore Geometry through Coxeter bio. Use #MathEdBookClub https://t.co/rFZnru7HTI","Twitter Web Client",168,,,,TRUE,FALSE,21,8,,,"MathEdBookClub",,"twitter.com/FieldsMathEd/s…","https://t.co/rFZnru7HTI","https://twitter.com/FieldsMathEd/status/1131891371382575105",,,,,,,,,"x878134022 x798710386518360068 x2212920252 x49666871 x278688410 x469277383 x4312362995","OAMEcounts mknrcm youcubed maanow canmathsociety sioroberts FieldsMathEd","en","x1131891371382575105","“King of Infinite Space” tells the life of Don Coxeter, the revolutionary Canadian Geometer. Check out this free documentary from the book’s author which tells the interesting story of Coxeter giving one of his last lectures: https://t.co/e2vBsmJtyX  thanks @judy11235813 ! https://t.co/DLSqA0dno5",2019-05-24 11:55:07,"Sendible",65,25,"x4312362995","FieldsMathEd","FieldsMathEd",945,614,737,"Toronto, Ontario","We are the mathematics education forum from the Fields Institute",FALSE,,,,,,,,,,,,,,,,,,,,,,"NA NA","NA NA","NA NA NA NA NA NA NA NA","https://twitter.com/FieldsMathEd/status/1137769788569214978","FieldsMathEd","Toronto, Ontario","We are the mathematics education forum from the Fields Institute","https://t.co/mioNyevGx7",FALSE,945,614,20,737,810,2015-11-29 00:13:09,FALSE,"https://t.co/mioNyevGx7","http://www.fields.utoronto.ca/programs/mathed/forum/index.html",,"https://pbs.twimg.com/profile_banners/4312362995/1451856217","http://abs.twimg.com/images/themes/theme1/bg.png","http://pbs.twimg.com/profile_images/683760471065915392/mrUJXSlg_normal.jpg"
"x4312362995","x1137751999292817408",2019-06-09 16:03:09,"FieldsMathEd","A new study revels the brain's knack for performing #mathematics by generalizing from one modality, such as vision, to another, such as touch. Our brains calculate a #statistical understanding of how objects behave based on our previous experiences. https://t.co/EInlaoxi0K","Twitter for iPhone",140,,,,FALSE,TRUE,0,2,,,"mathematics",,,,,,,,,,,,,"x84873162","FieldsInstitute","en",,,,,,,,,,,,,,,,"x1137743707074125829","A new study revels the brain's knack for performing #mathematics by generalizing from one modality, such as vision, to another, such as touch. Our brains calculate a #statistical understanding of how objects behave based on our previous experiences. https://t.co/EInlaoxi0K",2019-06-09 15:30:12,"Sprout Social",3,2,"x84873162","FieldsInstitute","The Fields Institute",9302,788,4111,"Toronto, Canada","The Fields Institute is a centre for mathematical research. Our mission is to provide a supportive and stimulating environment for mathematics innovation.",TRUE,,,,,,,"NA NA","NA NA","NA NA NA NA NA NA NA NA","https://twitter.com/FieldsMathEd/status/1137751999292817408","FieldsMathEd","Toronto, Ontario","We are the mathematics education forum from the Fields Institute","https://t.co/mioNyevGx7",FALSE,945,614,20,737,810,2015-11-29 00:13:09,FALSE,"https://t.co/mioNyevGx7","http://www.fields.utoronto.ca/programs/mathed/forum/index.html",,"https://pbs.twimg.com/profile_banners/4312362995/1451856217","http://abs.twimg.com/images/themes/theme1/bg.png","http://pbs.twimg.com/profile_images/683760471065915392/mrUJXSlg_normal.jpg"
"x4312362995","x1137751728655351808",2019-06-09 16:02:05,"FieldsMathEd","Coxeter used symmetry and mirrors to search for polytopes: Place 2 mirrors together at perfect angles to generate images of regular polygons. Student challenge: Which are possible to create this way? 
@FieldsMathEd @sioroberts https://t.co/bU2kJu8IQ0","Twitter for iPhone",139,,,,FALSE,TRUE,0,3,,,,,,,,,,,,,,,,"x1142609880","judy11235813","en",,,,,,,,,,,,,,,,"x1136833161147703296","Coxeter used symmetry and mirrors to search for polytopes: Place 2 mirrors together at perfect angles to generate images of regular polygons. Student challenge: Which are possible to create this way? 
@FieldsMathEd @sioroberts https://t.co/bU2kJu8IQ0",2019-06-07 03:12:01,"Twitter Web App",1,3,"x1142609880","judy11235813","Judy",114,40,889,"","",FALSE,,,,,,,"NA NA","NA NA","NA NA NA NA NA NA NA NA","https://twitter.com/FieldsMathEd/status/1137751728655351808","FieldsMathEd","Toronto, Ontario","We are the mathematics education forum from the Fields Institute","https://t.co/mioNyevGx7",FALSE,945,614,20,737,810,2015-11-29 00:13:09,FALSE,"https://t.co/mioNyevGx7","http://www.fields.utoronto.ca/programs/mathed/forum/index.html",,"https://pbs.twimg.com/profile_banners/4312362995/1451856217","http://abs.twimg.com/images/themes/theme1/bg.png","http://pbs.twimg.com/profile_images/683760471065915392/mrUJXSlg_normal.jpg"
"x4312362995","x1135156181692030977",2019-06-02 12:08:18,"FieldsMathEd","""When Donald began [at Marlborough], his marks ranked at the bottom of all...students...His obsession with the 4th dimension caused him to be dismally behind on some of the basics...His tutor forbade him from thinking in the 4th dimension, except on Sundays."" @FieldsMathEd https://t.co/HNO9oaa7KY","Twitter for iPhone",140,,,,FALSE,TRUE,0,4,,,,,,,,,,,,,,,,"x1142609880","judy11235813","en",,,,,,,,,,,,,,,,"x1134894818956644352","""When Donald began [at Marlborough], his marks ranked at the bottom of all...students...His obsession with the 4th dimension caused him to be dismally behind on some of the basics...His tutor forbade him from thinking in the 4th dimension, except on Sundays."" @FieldsMathEd https://t.co/HNO9oaa7KY",2019-06-01 18:49:44,"Twitter Web App",13,4,"x1142609880","judy11235813","Judy",114,40,889,"","",FALSE,,,,,,,"NA NA","NA NA","NA NA NA NA NA NA NA NA","https://twitter.com/FieldsMathEd/status/1135156181692030977","FieldsMathEd","Toronto, Ontario","We are the mathematics education forum from the Fields Institute","https://t.co/mioNyevGx7",FALSE,945,614,20,737,810,2015-11-29 00:13:09,FALSE,"https://t.co/mioNyevGx7","http://www.fields.utoronto.ca/programs/mathed/forum/index.html",,"https://pbs.twimg.com/profile_banners/4312362995/1451856217","http://abs.twimg.com/images/themes/theme1/bg.png","http://pbs.twimg.com/profile_images/683760471065915392/mrUJXSlg_normal.jpg"
"x4312362995","x1134893099753365504",2019-06-01 18:42:54,"FieldsMathEd","Hey #cmesg @cmesg2019 attendees! In case you missed it, you can watch Jean-Marie's De Koninck's Margaret Sinclair Award Lecture @FieldsInstitute from March 2016 at https://t.co/MoMYrIsx9x
@FieldsMathEd https://t.co/m6en8PaD8r","Twitter for iPhone",140,,,,FALSE,TRUE,0,1,,,"cmesg",,,,,,,,,,,,,"x1142609880","judy11235813","en",,,,,,,,,,,,,,,,"x1134892277141311488","Hey #cmesg @cmesg2019 attendees! In case you missed it, you can watch Jean-Marie's De Koninck's Margaret Sinclair Award Lecture @FieldsInstitute from March 2016 at https://t.co/MoMYrIsx9x
@FieldsMathEd https://t.co/m6en8PaD8r",2019-06-01 18:39:38,"Twitter Web App",1,1,"x1142609880","judy11235813","Judy",114,40,889,"","",FALSE,,,,,,,"NA NA","NA NA","NA NA NA NA NA NA NA NA","https://twitter.com/FieldsMathEd/status/1134893099753365504","FieldsMathEd","Toronto, Ontario","We are the mathematics education forum from the Fields Institute","https://t.co/mioNyevGx7",FALSE,945,614,20,737,810,2015-11-29 00:13:09,FALSE,"https://t.co/mioNyevGx7","http://www.fields.utoronto.ca/programs/mathed/forum/index.html",,"https://pbs.twimg.com/profile_banners/4312362995/1451856217","http://abs.twimg.com/images/themes/theme1/bg.png","http://pbs.twimg.com/profile_images/683760471065915392/mrUJXSlg_normal.jpg"
